{
  "$schema": "https://json-schema.org/draft/2020-12/schema",
  "$id": "urn:keycloak-nats:event:v1",
  "title": "Keycloak durable event envelope v1",
  "type": "object",
  "required": ["specversion", "id", "source", "type", "time", "datacontenttype", "dataschema", "data"],
  "properties": {
    "specversion": {"const": "1.0"},
    "id": {"type": "string", "format": "uuid", "description": "Stable transport ID; also sent as Nats-Msg-Id. Persist this in the consumer inbox."},
    "source": {"type": "string", "pattern": "^urn:keycloak:realm:[A-Za-z0-9_-]+$"},
    "type": {"type": "string", "pattern": "^io\\.keycloak\\.(user|admin)\\.[a-z0-9_]+$"},
    "time": {"type": "string", "format": "date-time"},
    "datacontenttype": {"const": "application/json"},
    "dataschema": {"const": "urn:keycloak-nats:event:v1"},
    "data": {
      "type": "object", "required": ["kind", "realmId", "outcome"],
      "properties": {
        "kind": {"enum": ["user", "admin"]}, "realmId": {"type": "string", "maxLength": 255},
        "keycloakEventId": {"type": "string"}, "userId": {"type": "string", "maxLength": 255}, "clientId": {"type": "string", "description": "Public Keycloak client ID. For admin events, resolved in actorRealmId; omitted when unavailable."},
        "sessionId": {"type": "string", "maxLength": 255, "description": "User session identified by Keycloak's source event, when available. Not an authentication-session ID or a guarantee of a newly created session."},
        "outcome": {"enum": ["success", "error"]}, "error": {"type": "string"},
        "eventType": {"type": "string"}, "operationType": {"enum": ["CREATE", "UPDATE", "DELETE", "ACTION"]}, "resourceType": {"type": "string"},
        "resourcePath": {"type": "string"}, "actorUserId": {"type": "string"}, "actorRealmId": {"type": "string"},
        "ordering": {
          "type": "object",
          "required": [
            "key",
            "sequence"
          ],
          "properties": {
            "key": {
              "type": "string",
              "maxLength": 2048,
              "pattern": "^u\\.[A-Za-z0-9_-]+\\.[A-Za-z0-9_-]+(?![\\s\\S])"
            },
            "sequence": {
              "type": "string",
              "pattern": "^(?:[1-9][0-9]{0,17}|[1-8][0-9]{18}|9[0-1][0-9]{17}|92[0-1][0-9]{16}|922[0-2][0-9]{15}|9223[0-2][0-9]{14}|92233[0-6][0-9]{13}|922337[0-1][0-9]{12}|92233720[0-2][0-9]{10}|922337203[0-5][0-9]{9}|9223372036[0-7][0-9]{8}|92233720368[0-4][0-9]{7}|922337203685[0-3][0-9]{6}|9223372036854[0-6][0-9]{5}|92233720368547[0-6][0-9]{4}|922337203685477[0-4][0-9]{3}|9223372036854775[0-7][0-9]{2}|922337203685477580[0-6]|9223372036854775807)(?![\\s\\S])",
              "maxLength": 19
            }
          },
          "additionalProperties": false,
          "description": "Per-user publication position. Local discard and subject filtering may leave gaps; this is not a contiguous-delivery protocol."
        },
        "userEnabled": {"type": "boolean", "description": "State observed during a successful direct USER create/update. Not a proof that enabled changed in this operation."}
      },
      "allOf": [
        {"if": {"required": ["ordering"]}, "then": {"required": ["userId"], "properties": {"userId": {"type": "string", "pattern": "[^\\u0009-\\u000d\\u001c-\\u0020\\u1680\\u2000-\\u2006\\u2008-\\u200a\\u2028\\u2029\\u205f\\u3000]"}, "realmId": {"type": "string", "pattern": "[^\\u0009-\\u000d\\u001c-\\u0020\\u1680\\u2000-\\u2006\\u2008-\\u200a\\u2028\\u2029\\u205f\\u3000]"}}}},
        {
          "if": {"properties": {"kind": {"const": "user"}}},
          "then": {
            "required": ["eventType"],
            "not": {"anyOf": [{"required": ["operationType"]}, {"required": ["resourceType"]}, {"required": ["resourcePath"]}, {"required": ["userEnabled"]}, {"required": ["actorUserId"]}, {"required": ["actorRealmId"]}]}
          },
          "else": {"required": ["operationType"], "not": {"anyOf": [{"required": ["eventType"]}, {"required": ["sessionId"]}]}}
        },
        {
          "if": {"properties": {"outcome": {"const": "error"}}},
          "then": {"required": ["error"], "not": {"required": ["userEnabled"]}},
          "else": {"not": {"required": ["error"]}}
        },
        {
          "if": {"required": ["userEnabled"]},
          "then": {"required": ["userId", "resourceType", "operationType"], "properties": {"kind": {"const": "admin"}, "outcome": {"const": "success"}, "resourceType": {"const": "USER"}, "operationType": {"enum": ["CREATE", "UPDATE"]}}}
        }
      ],
      "additionalProperties": false
    }
  },
  "allOf": [
    {
      "if": {"properties": {"data": {"properties": {"kind": {"const": "user"}}}}},
      "then": {"properties": {"type": {"pattern": "^io\\.keycloak\\.user\\.[a-z0-9_]+$"}}},
      "else": {"properties": {"type": {"pattern": "^io\\.keycloak\\.admin\\.(create|update|delete|action)$"}}}
    }
  ],
  "additionalProperties": false
}
