{
  "specversion": "1.0",
  "id": "1ae0d782-d25a-5686-adcb-6cc79df94a8e",
  "source": "urn:keycloak:realm:ZGVtbw",
  "type": "io.keycloak.admin.update",
  "time": "2026-09-24T12:00:00Z",
  "datacontenttype": "application/json",
  "dataschema": "urn:keycloak-nats:event:v1",
  "data": {
    "kind": "admin",
    "realmId": "demo",
    "outcome": "success",
    "resourceType": "USER",
    "operationType": "UPDATE",
    "resourcePath": "users/user-123",
    "userId": "user-123",
    "actorUserId": "admin-456",
    "actorRealmId": "master",
    "clientId": "admin-cli",
    "userEnabled": false
  }
}
