{
  "specversion": "1.0",
  "id": "c56c1502-81c0-510c-884c-24720072de2d",
  "source": "urn:keycloak:realm:ZGVtbw",
  "type": "io.keycloak.admin.action",
  "time": "2026-09-24T12:00:00Z",
  "datacontenttype": "application/json",
  "dataschema": "urn:keycloak-nats:event:v1",
  "data": {
    "kind": "admin",
    "realmId": "demo",
    "outcome": "success",
    "resourceType": "USER_SESSION",
    "operationType": "ACTION",
    "resourcePath": "users/user-123/logout",
    "actorUserId": "admin-456"
  }
}
